{
  "schemaVersion": "fsp-solution-to-manifest-recommendation/v1",
  "solutionInput": {
    "sourceAsset": "docs/ai/solution-inputs/core-admin-console.solution-input.json",
    "schemaVersion": "fsp-ai-solution-input/v1"
  },
  "planningInput": {
    "sourceAsset": "docs/ai/solution-plans/core-admin-console.solution-to-manifest-plan.json",
    "schemaVersion": "fsp-solution-to-manifest-plan/v1"
  },
  "application": {
    "name": "Core Admin Console",
    "manifestId": "core-admin-console",
    "packagePrefix": "com.fastservice.platform.derived"
  },
  "acceptedConstraints": [
    {
      "id": "keep-required-core-modules",
      "type": "required-core-modules",
      "reference": "docs/ai/module-registry.json#profiles/core-admin",
      "summary": "The current derivation still requires admin-shell, user-management, and role-permission-management as the stable core.",
      "effect": "The standalone app-manifest must keep the core-admin module set intact."
    },
    {
      "id": "preserve-initial-delivery-exclusions",
      "type": "explicit-excluded-modules",
      "reference": "docs/ai/solution-plans/core-admin-console.solution-to-manifest-plan.json#modulePlanning/excludedModules",
      "summary": "The planning output already excludes project-management, project-repository-management, kanban-management, and ticket-management for the initial derivation.",
      "effect": "Those delivery-management modules must remain out of the manifest unless planning is regenerated."
    }
  ],
  "recommendations": [
    {
      "id": "prefer-core-admin-profile",
      "category": "manifest-shaping",
      "target": "profile:core-admin",
      "recommendation": "prefer",
      "guidanceMode": "heuristic",
      "confidence": "high",
      "basis": [
        {
          "type": "profile-match",
          "reference": "docs/ai/module-registry.json#profiles/core-admin",
          "summary": "The core-admin profile exactly matches the deterministic planning output."
        },
        {
          "type": "planning-alignment",
          "reference": "docs/ai/solution-plans/core-admin-console.solution-to-manifest-plan.json#manifestPreparation",
          "summary": "The planning output resolves every required manifest field and leaves no unresolved conflicts."
        }
      ],
      "prerequisites": [
        "Keep admin-shell, user-management, and role-permission-management in the manifest",
        "Leave the excluded delivery-management modules deferred for this initial derivation"
      ],
      "boundaryNotes": [
        "This is optional guidance. Contributors may choose an equivalent standalone manifest as long as accepted constraints stay intact."
      ]
    },
    {
      "id": "defer-project-family-until-scope-expands",
      "category": "module-selection",
      "target": "project-management-and-dependent-modules",
      "recommendation": "defer",
      "guidanceMode": "constraint-derived",
      "confidence": "high",
      "basis": [
        {
          "type": "accepted-constraint",
          "reference": "acceptedConstraints/preserve-initial-delivery-exclusions",
          "summary": "The current business scope explicitly excludes the delivery-management module family."
        },
        {
          "type": "dependency-rule",
          "reference": "docs/ai/module-registry.json#modules/project-management",
          "summary": "Project-management is the dependency root for repository, kanban, and ticket workflows."
        }
      ],
      "prerequisites": [
        "Regenerate the planning artifact before reintroducing project-management or any downstream delivery module"
      ],
      "boundaryNotes": [
        "Because this recommendation is constraint-derived, contributors should not override it by editing the recommendation artifact alone."
      ]
    }
  ],
  "manifestShaping": {
    "suggestedProfile": "core-admin",
    "suggestedModules": [
      "admin-shell",
      "user-management",
      "role-permission-management"
    ],
    "notes": [
      "Produce a standalone app-manifest instead of passing planning or recommendation artifacts into assembly tooling.",
      "If a contributor deviates from heuristic guidance, they should record the reason next to the manifest source."
    ]
  },
  "followUpGuidance": [
    {
      "id": "record-heuristic-deviations",
      "topic": "manifest-review",
      "guidance": "If a contributor accepts different optional guidance than the repository recommendation, they SHOULD document which planning facts justify that manifest change before assembly.",
      "requiredBeforeAssembly": false
    },
    {
      "id": "refresh-planning-before-breaking-constraints",
      "topic": "planning-refresh",
      "guidance": "If a contributor wants to violate an accepted constraint, they MUST regenerate the planning artifact instead of editing the recommendation only.",
      "requiredBeforeAssembly": true
    }
  ],
  "manifestPreparationBoundary": {
    "standaloneManifestRequired": true,
    "nextStep": "Review the recommendation artifact, keep accepted constraints intact, decide whether to follow the suggested core-admin profile, and then create a standalone app-manifest before invoking ./scripts/platform-tool.sh assembly scaffold."
  }
}
